{
  "batteryCategory": "lmt",
  "operatorInformation": {
    "identifier": "VLhpfQGTMDYpsBZxvfBoeygjb",
    "emailAddress": "-w-......www-www-w-...--w--w.-w-www--.w...-w.www.w..-w..--.ww@.ww..-www-ww--ww.ww---w.w-w.w.ww...-w%mKozizkOjnxNSVyMliITPITDtxTLqUoUkEZlpZTvFMYBIjfUgqHyJIztdiBfETLcpZPXYcTSCSpSTTFAfi",
    "postalAddress": {
      "addressCountry": "Germany",
      "streetAddress": "Hindenburgstr. 10",
      "postalCode": "10719"
    },
    "contactName": "RYtGKbgicZaHCBRQDSx",
    "webAddress": "ftp://ftp.is.co.za/rfc/rfc1808.txt"
  },
  "productIdentifier": "eOMtThyhVNLWUZNRcBaQKxI",
  "batteryStatus": "Original",
  "puttingIntoService": "2025-06-17T11:14:27.698+02:00",
  "batteryMass": 699,
  "manufacturingDate": "2025-06-17T11:14:27.698+02:00",
  "batteryPassportIdentifier": "urn:bmwk:123456687678",
  "warrentyPeriod": "--06",
  "manufacturerInformation": {
    "identifier": "JxkyvRnL",
    "emailAddress": ".ww-...-ww...@ww.-..w.-www-.-.-w--w.ww--..-.w.ww.-...w.-.w.jGphZZQBHAFyIqSqHUNGwnomwanuIDiDpbLftOdDNZMwzMeqjAQpLVSSkKExPOypZXmRDeCGjVwKMtHHEhhmd",
    "postalAddress": {
      "addressCountry": "Germany",
      "streetAddress": "Hindenburgstr. 10",
      "postalCode": "10719"
    },
    "contactName": "yedUsFwdkelQbxeTeQOvaScfqIOOmaa",
    "webAddress": "telnet://192.0.2.16:80/"
  },
  "manufacturingPlace": {
    "addressCountry": "Germany",
    "streetAddress": "Hindenburgstr. 10",
    "postalCode": "10719"
  }
}